"id","title","description","user_id","photo_saved_at","created_at","updated_at"
2617142,"アラの出汁で炊く！圧力鍋で絶品鯛飯","鯛のアラが手に入ったらぜひ！しっかりしたお出汁で料亭のようなお味の鯛飯が簡単に作れます。",1850835,"2014-05-07 07:50:30","2014-05-07 07:47:12","2014-07-15 13:33:54"
3346789,"ソーセージ入り＊トマト丸ごとカレースープ","トマトを丸ごと1つ。カレー粉も使って、夏に美味しいスープです。",6795544,"2015-08-14 10:46:36","2015-08-14 10:45:41","2015-08-14 21:16:00"
6096344,"ピリ辛の温玉肉味噌うどん","さっぱり美味しい肉味噌うどんです。 エリンギを刻んで入れてるのでうまみ増し増しです。",15735327,"2020-03-23 20:36:50","2020-03-23 20:36:48","2020-03-25 13:15:34"
7251826,"究極しっとり！【リコッタチーズケーキ】","爽やかなリコッタチーズを使ったしっとりチーズケーキ。生地はすべてフープロで1度に混ぜるだけなので、とても簡単です。",1850835,"2023-07-10 23:36:04","2023-07-10 11:11:53","2023-07-10 23:40:13"
7255988,"クミン香る！鶏モモトマト煮込み","クミンの香りがポイントの、鶏モモのトマト煮込みです。",15735327,"2023-07-18 10:33:11","2023-07-15 00:04:38","2023-07-19 20:40:47"
1014225,"バレンタインに☆ココアのシンプルクッキー","焼くまでの準備時間は約10分。フードプロセッサーで超簡単にできて、お口でほろっと崩れる優しい味わいのクッキーですよ",1850835,"2010-01-18 19:35:52","2010-01-18 19:35:52","2019-10-03 13:08:23"
4299431,"【牛乳なし】ブルーチーズでカルボナーラ","チーズと卵だけで作るカルボナーラです！",10475640,"2017-01-19 20:49:51","2017-01-19 20:45:29","2017-08-05 20:13:18"
5680136,"カレー味！豚肉入りきんぴらごぼう","めんつゆとカレー粉で味付けも簡単♪豚肉も入って、ご飯の進むおかずです。しっかり味なのでお弁当にもおすすめ◎",6795544,"2019-06-13 23:15:25","2019-06-03 21:47:17","2019-06-14 07:57:26"
4970808,"豚の生姜焼きとピーナツバターのサンド","意外に合います",10475640,"2018-03-07 02:23:17","2018-03-07 02:23:13","2018-03-07 17:27:08"
2437682,"ヒヨコ豆のカレーサラダ","5分で出来ちゃう簡単サイドメニュー。カレー味のひよこ豆も美味しいですよ！",1850835,"2013-12-27 10:55:27","2013-12-17 13:17:11","2014-05-09 15:11:21"
7248364,"【1:1の黄金比】鶏もも肉の塩麹漬け","塩麹とみりんは1:1のシンプル配合です。漬けて焼くだけで極上のおかずになり、冷めてもおいしいのでお弁当にも◎",1850835,"2023-07-06 18:51:25","2023-07-06 10:53:26","2023-07-06 19:18:14"
6458305,"豚バラと茗荷と大葉で薬味たっぷり和パスタ","茗荷、大葉、ネギ、しょうが、薬味がたくさんで、さっぱり美味しいパスタです。 ランチにおすすめです。",15735327,"2020-09-22 10:24:51","2020-09-22 10:24:40","2020-09-22 10:44:06"
3389006,"桃と生ハムで作るイタリアンサラダ","旬の桃を使ったイタリアンサラダ。生ハム入りでちょっと贅沢に♪",6795544,"2015-09-07 15:27:40","2015-09-07 07:01:36","2015-09-12 17:48:27"
3404561,"エジプト塩で☆エスニックそぼろおにぎり","お肉と相性のいいエジプト塩を使って、簡単おにぎりです。 ",6795544,"2015-09-14 17:46:03","2015-09-14 17:34:16","2015-09-14 22:59:26"
4961134,"彩り豊か！ホワイトソースのパドンニパスタ","おもてなし・パーティに最適♪ 簡単につくれて、彩りも良く、とても美味しいです(^-^)",11300511,"2018-02-28 20:20:36","2018-02-28 20:20:29","2018-03-01 07:51:23"
3509851,"簡単！コーンバターの混ぜごはん","コーンを使った簡単混ぜごはんです。お弁当にぴったり。",6795544,"2015-11-11 07:53:45","2015-11-11 07:30:41","2015-11-11 07:54:36"
4993462,"糖質オフ☆ココナッツミルク&アー乳プリン","ココナッツミルクとアーモンドミルクを使い、糖質控えめのデザートです。甘さ控えめなので、トッピングで調整します。",6795544,"2018-03-21 18:08:12","2018-03-21 18:08:06","2018-03-21 18:24:22"
3722835,"わかめとエノキの和風和え・わさび入り","油を使わないからヘルシー！",6795544,"2016-03-01 20:35:25","2016-03-01 20:29:46","2016-03-03 12:58:32"
4312205,"韓国風ミニ海苔巻き★コマキンパ","小さくて食べやすい韓国風海苔巻き。巻き簾なしで気軽に作れるのもいいです♪節分の恵方巻き代わり、お弁当にも。",6795544,"2017-02-02 11:08:46","2017-01-26 10:53:34","2017-02-02 11:08:46"
5090699,"鶏もも肉とズッキーニのポン酢炒め","ポン酢でさっぱり、でもこってり満足感",10475640,"2018-05-24 23:35:03","2018-05-24 23:34:58","2018-05-25 14:01:19"
6009735,"シンプルでヘルシーな豚しゃぶ","シンプルな豚しゃぶです",15735327,"2020-01-29 14:39:01","2020-01-29 14:38:59","2023-07-16 13:51:54"
2799714,"おにぎらず〜長方形海苔ver.〜","すごーく簡単で、バリエーション豊富な『おにぎらず』を長方形の海苔（手巻き海苔）で作ってみました。",6795544,"2014-09-16 17:53:37","2014-09-16 17:49:16","2015-08-06 12:39:08"
5902076,"スープジャーで鶏飯(けいはん)弁当","鹿児島の鶏飯(けいはん)をスープジャーを使って再現しました♪",6795544,"2019-11-08 09:47:30","2019-11-08 09:47:28","2019-11-12 16:24:16"
5044241,"カレーリメイクつけ麺","余ったカレーでつけ麺(うどん)",10475640,"2018-04-23 21:15:53","2018-04-23 21:15:49","2018-09-06 02:13:33"
5803455,"レンジで焼き肉！？タレ漬け牛肉の胡麻和え","フライパンを使わず、電子レンジで調理が楽チン！ご飯がススムので、お弁当のおかずにもオススメです。",6795544,"2019-08-29 20:09:01","2019-08-29 20:07:39","2019-08-29 20:24:58"
6064508,"かぼちゃの煮物★ピーナッツバター風味","普通うのかぼちゃの煮物ですがちょっとコクを出したいなと思ってピーナッツバターを加えてみました。歯ごたえも出て良い感じ。",1850835,"2020-03-04 09:25:20","2020-03-04 09:20:25","2020-03-04 09:35:46"
7091708,"ブロッコリーとツナと大豆の糖質オフサラダ","タンパク質をしっかり取りたい時におすすめのサラダです。糖質制限中にぴったり！作り置き、サラダ弁当にも◎",6795544,"2023-01-28 12:23:12","2023-01-28 12:23:09","2023-02-14 19:29:20"
2829052,"お弁当に☆ツナマヨチーズはんぺん","お弁当にぴったりの簡単＆汁漏れしないおかず！",6795544,"2014-10-07 23:30:34","2014-10-07 23:26:50","2015-05-12 08:29:51"
4209929,"炒めて簡単！コンビーフポテト","コンビーフとじゃがいもで作る簡単おかず。お弁当やおつまみにも。",6795544,"2016-11-30 07:33:11","2016-11-29 23:15:53","2017-12-10 13:37:25"
4459676,"糖質オフ！ご飯なし！納豆と豆腐でポキ丼風","ご飯抜きでもお腹いっぱいに！火を使わず、15分ほどで作れるので時短レシピにもなります。",6795544,"2017-04-08 10:26:21","2017-04-08 10:26:18","2017-04-08 10:57:00"
4380913,"ミートソーススパゲティのリメイクグラタン","作りすぎたミートソーススパゲッティをリメイク！ボリュームたっぷりの一品に。ナポリタンも同様にアレンジ可能です。",6795544,"2017-02-26 15:36:47","2017-02-26 15:33:25","2017-02-26 16:00:34"
1210868,"チキンソテーのラタトゥユソース","チキンをシンプルにソテーし、野菜たっぷりのラタトゥユをソースにしていただきます。付け合わせにはぜひクスクスを。",1850835,"2010-08-15 14:59:41","2010-08-15 14:59:41","2010-09-29 11:41:08"
3493505,"ゆかりと柚子胡椒入り・とろろ昆布おにぎり","柚子胡椒おにぎりをアレンジ。和風でさっぱりしたおにぎりです。",6795544,"2015-11-03 12:56:15","2015-11-03 12:01:38","2015-11-05 12:22:39"
5036535,"鶏ハムとアボカドのコロコロ和え","鶏ハムでできるスピードメニューです",10475640,"2018-04-18 23:46:36","2018-04-18 23:46:31","2018-04-18 23:46:36"
5462721,"エリンギのサラダ","エリンギソテーを乗せたサラダです",10475640,"2019-01-21 13:05:41","2019-01-21 13:04:49","2019-01-21 13:12:06"
5700063,"ごぼうとベーコンのアンチョビソース炒め","ごぼうとベーコンの洋風おかず。アンチョビソースがあるときに♪",6795544,"2019-06-16 15:16:44","2019-06-16 15:16:42","2019-06-16 19:22:57"
4126767,"袋でモミモミ！簡単・鶏胸肉のピカタ","洗い物を最小限に。お弁当にもぴったりです。※写真は半量ほどのものになります。",6795544,"2016-10-17 10:48:57","2016-10-17 10:48:34","2016-10-17 10:59:17"
4872827,"黒豆と黒蜜のマフィン","頂き物の奄美の黒蜜を活かしたくて焼いたマフィンに黒豆をトッピング。ほっこり優しい味わいで、ほうじ茶と一緒にいただきたい。",1850835,"2018-01-06 09:36:47","2018-01-06 09:36:42","2018-01-07 18:23:09"
5151193,"スープジャーで◎杏仁キウイの冷スイーツ","スープジャーを使った冷たいスイーツです。杏仁豆腐とキウイのサッパリした組み合わせ。夏のお弁当のデザートに♪",6795544,"2018-07-03 12:25:20","2018-07-03 12:25:16","2018-07-07 09:58:12"
5678359,"節約＊鶏ひき肉でチンジャオロース風そぼろ","安い鶏ひき肉を使ってチンジャオロース風そぼろ♪小分けにして冷凍保存も可能です。",6795544,"2019-06-03 20:38:11","2019-06-02 19:40:16","2019-06-10 17:27:11"
5611689,"アボカドトースト","おいしいアボカドのトーストです",10475640,"2019-04-20 11:04:22","2019-04-20 11:04:20","2019-06-06 08:54:55"
2551824,"胡麻が香る！桜海老と青海苔のおにぎり","炊きあがったご飯に混ぜるだけ。簡単ですが大人も子供も大好きなおにぎりができました。",1850835,"2014-03-20 16:04:48","2014-03-20 16:00:36","2014-03-20 16:12:24"
5503780,"お弁当に◎ツナとブロッコリーのマヨ焼き","お弁当箱の形に合わせてアルミホイルで型を作れば隙間ができる心配もなし！",6795544,"2019-02-13 09:04:01","2019-02-13 08:53:40","2019-02-13 09:09:12"
5880722,"フワリ漆黒★ブラック台湾カステラ","ふわっふわの台湾カステラをブラックスイーツに。口どけの良いやわらかな生地にクリームがよく合います。ハロウィンにも！",1850835,"2019-10-30 06:38:40","2019-10-23 14:08:20","2019-10-30 06:41:48"
5550811,"ポトフ","やさしい味のポトフ",10475640,"2019-03-12 13:43:05","2019-03-12 13:32:54","2019-03-12 13:43:14"
6008313,"マトンのベルベルオムレツ","モロッコ料理のベルベルオムレツをマトン肉で再現しました。",30696264,"2020-01-28 15:57:46","2020-01-28 15:45:04","2020-01-28 15:58:31"
6232576,"厚切り食パンで大満足ピザトースト","厚切り食パンで作るおいしいピザトーストです。 にんにく、オリーブ、クリームチーズがいい仕事をします！",10475640,"2020-05-17 13:49:06","2020-05-17 12:50:55","2020-05-17 13:57:04"
3149509,"こってり満足＊クリームチーズパスタ","ベーコンたっぷりで満足できるクリームチーズパスタです。",10475640,"2015-04-29 23:54:02","2015-04-29 22:18:49","2016-04-26 10:20:53"
6010383,"ラム肉とパクチーの無水トマト煮","材料切ってにこむだけ。野菜の水分だけで煮込むので旨味が濃いです。",30696264,"2020-01-29 20:36:52","2020-01-29 20:36:50","2020-02-02 09:57:45"
6065051,"イカ丸ごと！イカわたのトマトリゾット","イカわたのコクとレモンの酸味で野菜がいくらでも食べられます。",30696264,"2020-03-06 06:49:41","2020-03-04 15:18:33","2020-03-06 06:49:41"
1015482,"風邪引きさんのあんかけ粥","生姜を効かせて、身体がぽかぽかあったまるお粥です。きのこたっぷりのあんかけは、風邪引きさんでもしっかり食べられます。",1850835,"2010-01-20 08:40:48","2010-01-20 08:40:48","2010-07-28 14:14:55"
3507302,"人参と貝柱のエジプト塩サラダ","お気に入りのエジプト塩を使った、簡単彩りおかずです。",6795544,"2015-11-09 21:46:52","2015-11-09 21:36:07","2015-11-09 21:47:00"
5710825,"豚肉とインゲンのシーズニングソース炒め","大好きなシーズニングソースシリーズです。今回は豚肉とインゲンを組み合わせてみました♪",6795544,"2019-06-23 19:10:49","2019-06-23 19:10:46","2019-06-23 19:17:07"
6309714,"抹茶のテリーヌ","濃厚な抹茶のテリーヌです。 京都マールブランシュの抹茶フォンダンショコラのような口溶け。",15735327,"2020-06-21 16:07:23","2020-06-20 22:38:02","2023-02-13 15:54:39"
1524576,"椿油ご飯","義母から教わった福岡の郷土料理。シンプルな炊き込みご飯に椿油を入れます。炊きあがりはツヤツヤで、おかずが要らない存在感！",1850835,"2011-08-17 06:49:30","2011-08-17 06:49:29","2016-01-15 10:06:57"
4206931,"わさび入り！ナスの麺つゆおかか和え","シリコンスチーマーで作る簡単おかず。電子レンジ利用で時短にもなります。お弁当の隙間埋めにも！",6795544,"2016-11-28 10:47:52","2016-11-28 10:47:48","2017-08-19 22:19:48"
4811059,"大満足チキンのっけサラダ","鶏もも肉と葉物があるとよく作ります。お肉も野菜も食べられる大満足サラダです。",10475640,"2017-11-18 17:44:31","2017-11-18 17:44:27","2017-11-19 22:15:22"
4988817,"低糖質☆大豆粉で豚こま肉の青じそピカタ","小麦粉、片栗粉を使わずに大豆粉で。豚こま肉を使って食べ応えも♪青じそ風味で和風な仕上がりです。お弁当おかずにもなります。",6795544,"2018-03-18 19:56:19","2018-03-18 19:56:15","2018-03-18 20:16:34"
3435771,"えのきのバター&ごまポン酢炒め","ごまポン酢がなければ、普通のポン酢で代用できますが、メーカーによって味がかなり違うので、味見しながら加えて下さい",6795544,"2015-10-01 21:45:33","2015-10-01 21:44:00","2015-10-01 21:52:43"
5092013,"おつまみ辛きゅうり","ボウルで混ぜるだけで簡単おつまみきゅうり！",10475640,"2018-05-25 22:12:59","2018-05-25 22:12:54","2018-05-25 22:12:59"
5152216,"アボカドと鯖フィレのサラダうどん","夏ですね！すぐ出来る冷たいサラダうどんです",10475640,"2018-07-03 23:44:52","2018-07-03 23:44:49","2018-07-03 23:44:53"
7251466,"キムチコブサラダ","美味しいキムチは最高の調味料",30696264,"2023-07-09 20:40:24","2023-07-09 20:40:22","2023-07-09 20:47:25"
1296508,"具だくさんのベジタブルコーンスープ","具だくさんの食べるスープです。小さめに切った野菜がたっぷり。コーンの甘みで、野菜嫌いな子供もモリモリ食べてくれます。",1850835,"2010-11-28 14:29:48","2010-11-28 14:29:48","2010-11-29 06:49:24"
4467357,"糖質オフ！生ハムカッテージチーズトースト","糖質制限中でも美味しい朝ごはんが食べたーい！ふすまパンをアレンジしましたが、普通の食パンでも使えるトーストレシピです。",6795544,"2017-04-12 10:30:02","2017-04-12 10:29:58","2017-04-12 16:41:19"
5116864,"大量消費！白だしでいんげんの胡麻和え","もう1品欲しい時にどうぞ！ 白だしがきいてて美味しいです。 おつまみにもどうぞ！  写真はこの分量の1/4です。",15735327,"2018-06-10 21:13:29","2018-06-10 21:13:13","2021-01-01 14:09:33"
5592880,"旨味凝縮！トマトとサバ缶のスープ","トマト缶とサバ缶で作れる美味しい糖質オフのスープ。もち麦を入れることでボリューム感も出ます。温かくても冷たくしても美味♪",1850835,"2019-04-09 17:06:22","2019-04-08 16:03:40","2019-04-09 17:07:00"
3629429,"スパムと高菜のおにぎらず","スパムだけより、漬物と合わせた方がさっぱり食べれて好みです。",6795544,"2016-01-18 09:50:03","2016-01-18 09:46:36","2016-01-18 09:58:12"
4118225,"ミニトマト・トマトで作る味噌汁","冷凍してあったミニトマトを使って味噌汁に。意外と合うんです。 もちろん冷凍してないミニトマトでも、トマトでも大丈夫です。",6795544,"2016-10-12 08:32:13","2016-10-12 08:32:09","2016-10-12 08:36:24"
3241523,"ノリベンジャー","真っ黒で味気ない海苔弁もジャーに入れれば、ちょっとオシャレに？！",6795544,"2015-06-16 22:21:47","2015-06-16 22:01:13","2015-06-16 22:32:47"
3994213,"イングリッシュ・スコーン","イギリスに旅行した際、現地のおばさまから教わりました。卵を使わないトラディショナルな本場のレシピです。",1850835,"2016-07-26 11:45:12","2016-07-26 11:45:09","2017-06-14 13:45:45"
7166514,"鶏胸肉スイチリ","子どもも好きな甘辛こってりなお味だと思います。",10475640,,"2023-04-06 16:10:12","2023-04-06 16:27:43"
5013068,"はちみつのドレッシング","甘めのドレッシングです",10475640,,"2018-04-03 23:58:05","2018-04-04 00:00:31"
6748587,"世界一簡単で美味しいコーヒーゼリー","「世界一簡単で美味しい」というのは自分調べなので異論はあるかもしれません。でも本当にこの方法がベストだと思うのです。",1850835,"2021-04-23 14:51:52","2021-04-23 14:50:49","2021-04-23 18:26:02"
2917748,"簡単！海老の炊き込みピラフ","お昼にちょっぴり気分がアガるピラフ。冷蔵庫の残り物&炊飯器を活用して簡単に、大人も子供も大満足なランチができました。",1850835,"2014-12-07 13:22:24","2014-12-07 11:54:24","2014-12-08 23:16:19"
5475658,"お弁当の一品に！ゆで卵のめんたいマヨ焼き","明太子とマヨネーズのディップをゆで卵に乗せてトースターで焼くだけ。お弁当おかずにもオススメです。",6795544,"2019-01-28 19:38:33","2019-01-28 19:32:12","2019-02-03 22:03:43"
7167921,"春！苺とモッツァレラのサラダ","いちごをサラダに！モッツァレラとの相性も抜群です。",15735327,"2023-04-07 23:42:05","2023-04-07 23:40:47","2023-04-07 23:48:28"
3602345,"豚肉とキャベツの中華風野菜炒め","お弁当おかずに、しっかり味の野菜炒めです。辛くないので、辛いものが苦手な人も大丈夫。",6795544,"2016-01-03 19:44:57","2016-01-03 19:32:51","2016-01-05 12:51:42"
4295277,"節分にオススメ！簡単♡オニのキャラ弁","節分に向けて作りたい、おにのキャラ弁（顔弁）です。細かい作業は少ないので、意外と簡単にできます。子供用にもオススメです。",6795544,"2017-01-17 20:51:03","2017-01-17 20:50:55","2017-01-18 11:40:25"
6105079,"お弁当の卵焼きをアレンジ！海苔入り卵焼き","ちょっと湿気った海苔も卵焼きに入れれば問題なし！卵焼きの簡単アレンジレシピです。",6795544,"2020-03-29 13:41:05","2020-03-29 13:41:03","2020-03-29 13:47:22"
5115248,"簡単！ズッキーニとベーコンのおつまみ！","ズッキーニとベーコンを炒めた、ビールやワインにも合うおつまみです！",15735327,"2018-06-09 22:13:35","2018-06-09 22:04:30","2018-06-09 22:13:40"
5321262,"えのきむち","おつまみにも。",10475640,"2018-11-03 21:31:52","2018-11-03 21:31:48","2023-07-07 19:53:45"
3454940,"ごぼうピーマン人参のポン酢キンピラ","にんじんが足りなかったので、ピーマンを入れてみました。ポン酢と生姜でさっぱりと。",6795544,"2015-10-12 20:16:46","2015-10-12 20:06:59","2015-10-16 08:23:55"
5024359,"新玉ねぎとリンゴのサラダ","新玉ねぎとリンゴのサラダです！",10475640,"2018-04-11 13:33:49","2018-04-11 13:33:45","2018-04-11 13:34:42"
6493982,"市販のスープの素で！押し麦トマトリゾット","お鍋を使わずに、レトルトスープの素で作る簡単リゾットです。スープジャーの季節にぴったり！",6795544,"2020-10-18 06:53:49","2020-10-18 00:04:25","2020-10-18 12:40:26"
3729920,"新玉ねぎのトマトソースパスタ","新玉ねぎの季節に作りたい、甘みとコクのあるトマトソースパスタ。",1850835,"2016-03-05 12:31:02","2016-03-05 12:30:43","2016-05-30 16:21:08"
4132528,"パンの耳で！バジル塩のラスク","サンドイッチの残りのパンの耳をアレンジして、ラスクを作りました。",6795544,"2016-10-20 10:42:13","2016-10-20 10:42:09","2016-10-20 13:08:48"
5960457,"海苔佃煮＆クリームチーズのトースト","私が最近ハマっている新感覚トーストです。え゛と思いましたがちゃんと美味しい（と私は思う）のでレシピ化しました。",1850835,"2019-12-23 12:02:43","2019-12-23 12:00:58","2019-12-23 12:06:11"
7250733,"意外とヘルシー！血合のトマトカレー","じつは高タンパク低脂質の血合。健康も家計も手に入れてください。",30696264,"2023-07-08 21:52:42","2023-07-08 21:51:49","2023-07-08 22:08:35"
3087989,"彩り◎クレソン&ベーコンの洋風炒め","卵入りで、彩りもいい感じに♪サラダのイメージが強いクレソンは、炒めても美味しかったです。",6795544,"2015-03-26 14:37:50","2015-03-26 14:29:48","2018-02-22 16:46:07"
5039005,"やさしいナポリタン風パスタ","甘口でお子さんも食べやすいパスタです",10475640,"2018-04-20 15:51:15","2018-04-20 15:51:11","2018-04-20 15:51:48"
6114966,"いんげんと豚塊肉の煲仔飯風","香港の土鍋ご飯です。蓋を開けた瞬間フワッと香るオイスターソースがたまりません。",30696264,"2020-04-05 11:44:47","2020-04-04 16:23:46","2020-04-28 08:28:11"
1948118,"ロシアンクッキー","材料４つ、オーブンに入れるまで10～15分。簡単で誰からも褒められる極上クッキーの出来上がり。",1850835,"2012-09-09 15:09:45","2012-09-09 15:09:45","2016-07-28 11:49:01"
4967505,"胡麻豆腐で！塩昆布入り小松菜の白和え風","濃厚な胡麻豆腐を使うので、味噌は使わず醤油と塩昆布で味付けはシンプルに。",6795544,"2018-03-04 21:56:15","2018-03-04 21:52:43","2018-03-04 22:09:07"
5031377,"おかひじきとキャベツのパスタ","アンチョビとにんにく味です。",10475640,"2018-04-15 21:45:19","2018-04-15 21:45:15","2018-04-16 12:40:42"
5249079,"キムチ焼きそば","ふつうのキムチ焼きそばです",10475640,"2018-09-13 14:55:34","2018-09-13 14:55:30","2018-09-13 14:55:34"
6169349,"醤大骨風！豚背骨の中華甘味噌煮","東北中華料理の醤大骨を家にある調味料で再現してみました。",30696264,"2020-04-26 11:36:21","2020-04-26 11:36:18","2020-04-26 15:09:37"
7258692,"ラムラグーパスタ","ラム肉のラグーソースのパスタです。 パスタ以外にも、グラタンのソースにしても美味しいです",15735327,"2023-07-18 10:34:37","2023-07-18 10:34:35","2023-07-19 20:58:52"
2214138,"チキンの柚子胡椒ソテー","ピリリと柚子胡椒をきかせた大人味のチキンソテーです。私は普通の照り焼きチキンよりもこちらが好きです。 ",1850835,"2013-05-06 22:39:36","2013-05-06 22:39:36","2015-01-19 15:50:09"
3603993,"大豆ミートの甘ダレ焼き","大豆ミートを使った簡単おかず。しっかり味でご飯が進みます。",6795544,"2016-01-04 21:46:43","2016-01-04 21:40:45","2016-01-04 21:52:42"
3762280,"トリュフ塩の卵焼き","トリュフの風味がたまらなーい贅沢な卵焼きです。",6795544,"2016-03-21 17:30:44","2016-03-21 17:30:34","2016-03-21 17:34:39"
1015476,"春菊の胡麻味噌和え","春菊の美味しさが詰まっています。調味料は全て大匙１ずつ！覚えやすくて超簡単です。",1850835,"2010-01-20 08:31:00","2010-01-20 08:31:00","2016-01-19 09:41:41"
1210855,"本気のポテトサラダ","本気で丁寧に作ったポテトサラダは、メインになれるくらいの存在感。じゃがいもとタマネギにしっかり味がしみて美味しいです。",1850835,"2010-08-15 14:33:00","2010-08-15 14:32:45","2013-11-11 11:53:21"
3457318,"鮭フレークと大葉で簡単混ぜごはん","お弁当に使える簡単混ぜごはん！",6795544,"2015-10-14 07:31:13","2015-10-14 07:11:51","2015-10-14 07:32:58"
3776150,"パンの耳で！トリュフ塩のラスク","サンドイッチを作ったら、耳を使ってもう一品！トリュフ塩を使って、ちょっぴりリッチな味のラスクです。",6795544,"2016-03-29 08:21:13","2016-03-29 08:21:07","2016-04-02 16:16:39"
5006182,"糖質オフ★鶏むね肉の柚子マヨ和え","糖質制限中に食べたい、鶏むね肉の低糖質な一品♪柚子胡椒とマヨネーズの組み合わせは結構お気に入りです。",6795544,"2018-03-30 02:14:32","2018-03-30 02:09:49","2018-03-30 02:19:59"
5022047,"ほうれん草のピーナツバター和え","ごま和えをピーナツバターでやってもおいしいのです",10475640,"2018-04-09 21:44:44","2018-04-09 21:44:41","2018-04-09 21:44:44"
