"id","title","description","user_id","photo_saved_at","created_at","updated_at"
5344845,"鮭アボカドチーズごはん","朝ごはんにどうぞ！",15735327,"2018-11-20 09:08:04","2018-11-20 09:07:56","2018-11-20 09:14:10"
2394381,"サツマイモのハチミツレモン煮","簡単にもう1品。レモン＆ハチミツの黄金コンビで甘酸っぱいさつまいも煮に。",1850835,"2015-08-03 09:21:17","2013-11-02 19:58:04","2018-06-14 15:25:48"
4257913,"簡単かわいいキャラ弁☆ニワトリおにぎり","簡単キャラ弁（顔弁）を作りました。ニワトリのおにぎりはツナマヨ入り。お子様用のお弁当にも、イースターにもいいと思います♪",6795544,"2016-12-27 09:46:28","2016-12-27 09:46:19","2017-05-18 13:24:09"
1210332,"夏野菜の揚げ浸し","夏の定番！野菜は油をさっと通すとぐっと美味しくなりますね。野菜の美味しさを味わえるシンプルな出汁＋醤油が一番です。",1850835,"2010-08-14 16:05:03","2010-08-14 16:05:03","2011-08-11 22:51:22"
4992442,"明太マヨソース","みんな大好き明太マヨソース",10475640,"2018-03-20 23:55:03","2018-03-20 23:48:35","2018-03-20 23:55:21"
2871692,"枝豆と桜海老の簡単混ぜ御飯","超簡単！彩りも良くモリモリ食べたくなる混ぜ御飯。私はつくづく、桜海老とか胡麻油とか好きなんだな〜",1850835,"2014-11-06 19:40:34","2014-11-06 18:41:53","2014-11-08 07:48:56"
4442007,"アーモンドミルクでふわ②フレンチトースト","アーモンドミルク（アー乳）でフレンチトーストを作りました。牛乳の代用として、コンビニでも買えるアー乳オススメです。",6795544,"2017-03-29 21:50:52","2017-03-29 21:50:48","2017-03-30 21:43:25"
5674747,"鶏むね肉とネギのマスタードマリネ","母から伝授された、作りおきにも便利な定番胸肉レシピ。暑い時期でもモリモリ食べられて、糖質オフにもなります。",1850835,"2019-05-31 14:41:20","2019-05-31 14:40:17","2019-06-04 23:33:54"
6046392,"昆布だしと玉子のおかゆ","体調が悪い時にやさしいおかゆです",10475640,,"2020-02-21 17:06:00","2021-11-22 10:53:03"
3338799,"ハムチーズの簡単ホットサンド","冷蔵庫にあるものでパパッと作るハムチーズのホットサンド。すぐできるから夜食や朝食にもおすすめです。",6795544,"2015-08-08 21:55:12","2015-08-08 21:54:31","2016-10-05 19:23:06"
5116134,"カリカリ梅入り！ツナ缶でさっぱりそうめん","夏に美味しいさっぱりそうめんです！ツナ缶うますぎ。",10475640,"2018-06-10 14:54:24","2018-06-10 14:54:20","2018-06-10 15:10:10"
4130009,"しゃぶしゃぶ用の牛肉で！肉巻きおにぎり","たまに作る贅沢メニュー♡お弁当にもオススメです！",6795544,"2016-10-18 23:00:47","2016-10-18 22:58:34","2016-10-19 07:10:21"
5271629,"鶏とネギときのこのバター醤油パスタ","きのこと鶏のうまみがドーンのパスタです",10475640,"2018-09-29 22:37:18","2018-09-29 22:23:54","2018-12-31 13:02:54"
5050578,"ぽん酢ピーナツバタードレッシング","ぽん酢とピーナツバターも合うんです",10475640,"2018-04-27 21:38:00","2018-04-27 21:37:56","2018-04-27 21:38:00"
3852725,"梅干しと白ごまの混ぜご飯","日の丸弁当もいいけど、ごはんにあらかじめ梅干しを混ぜるとおにぎりにもしやすくていいです。",6795544,"2016-05-11 09:31:40","2016-05-11 09:31:10","2016-05-19 15:50:00"
4988781,"エジプト塩♡ブロッコリーと鶏胸肉の和え物","お気に入りの調味料エジプト塩を使いました！ブロッコリーと鶏ムネ肉で作るヘルシーなおかずです。",6795544,"2018-03-18 19:40:39","2018-03-18 19:40:25","2018-03-26 01:54:26"
6205281,"ソーセージでジャーマンポテト風","ちょっぴりジャンキーなおつまみおかずです。",10475640,"2020-05-07 20:01:47","2020-05-07 20:01:45","2020-05-18 20:17:16"
5043711,"ナスとおかひじきのピリ辛炒め","ナスおいしい",10475640,"2018-04-23 16:54:46","2018-04-23 16:54:42","2018-06-01 12:26:07"
5406927,"我が家のもつ鍋！","鍋で温まりたいときに。 もつ鍋を自宅で食べたところ美味しかったので備忘録です。",15735327,"2018-12-10 21:10:49","2018-12-10 21:10:41","2018-12-10 21:23:11"
5014929,"レモンカードとクリームチーズのトースト","レモンカードの甘みとクリームチーズの酸味が相性がグッド",10475640,"2018-04-05 10:04:59","2018-04-05 10:04:53","2018-04-05 10:08:28"
5669580,"ブロッコリーの柚子胡椒マヨ和え","柚子胡椒とマヨネーズを和えるのがお気に入り♪お弁当のおかずに、今回はブロッコリーと和えてみました。",6795544,"2019-06-01 23:10:33","2019-05-28 08:30:15","2019-06-02 14:41:50"
6495818,"鍋不要！スープジャーでテールスープご飯","無印良品のインスタントスープの素を使ったスープご飯。押し麦がもちもちで美味しいです。",6795544,"2020-10-19 12:42:27","2020-10-19 12:42:25","2020-10-19 12:49:11"
3465883,"ほうれん草とコーンのバター炒め","お弁当の定番おかず。彩りも良いので活躍します。",6795544,"2015-10-18 20:40:42","2015-10-18 20:34:08","2015-10-18 20:45:02"
5008863,"菜の花の明太子パスタ","春ですね",10475640,"2018-04-01 00:59:28","2018-04-01 00:59:24","2018-04-01 01:01:44"
5678662,"お弁当に◎カニ風味かまぼこ入り卵焼き","お弁当にぴったりの卵焼きです。カニカマ入りで優しいお味。今回は崩して焼きましたが、巻いて作るのももちろんオッケーです◎",6795544,"2019-06-03 20:36:46","2019-06-02 22:20:43","2019-06-20 11:43:36"
5672885,"ブロッコリーと卵のマヨサラダ","ゆで卵とブロッコリーの簡単マヨサラダです。マヨラーにおすすめ！",6795544,"2019-05-30 11:40:43","2019-05-30 11:36:21","2019-06-02 08:26:35"
5698039,"卵2個で作る◎なめ茸入り卵焼き","なめ茸入りの卵焼きは、お弁当におすすめの一品です。いつもの卵焼きをアレンジしてマンネリ解消にも◎",6795544,"2019-06-15 11:40:08","2019-06-15 11:39:09","2020-07-08 10:25:37"
4215275,"カニカマでサンタクロース★クリスマス弁当","簡単にできてクリスマスっぽいお弁当です。カニカマととろろ昆布で、凝った材料は使いません。",6795544,"2016-12-02 23:10:59","2016-12-02 23:10:54","2018-12-17 14:06:39"
5011582,"アンチョビガーリックポテト","かんたんおつまみメニュー",10475640,"2018-04-02 23:20:22","2018-04-02 23:20:18","2018-04-03 21:11:08"
5969561,"きのこ汁","きのこのうまみたっぷりのスープです。味付けは白だしのみ。",10475640,"2019-12-31 10:31:51","2019-12-31 10:31:47","2020-02-03 12:35:05"
6281968,"きゅうりのキューちゃんで！タルタルソース","チキン南蛮の付け合わせに、タルタルソースを作りました。きゅうりのキューちゃんの食感がいい感じ！",6795544,"2020-06-06 23:19:26","2020-06-06 23:15:57","2020-07-23 12:02:33"
3900708,"顔弁の作り方〜そぼろ編〜","そぼろを使って簡単にかわいいお弁当を。凝ったキャラ弁よりは簡単です♪",6795544,"2016-06-05 08:33:20","2016-06-05 08:33:14","2016-06-05 08:50:58"
4003786,"豚肉とミョウガのとろっとバタぽん炒め","ミョウガを使って、ご飯が進むおかずを作りました。",6795544,"2016-08-01 20:54:19","2016-08-01 20:54:11","2016-09-06 11:15:10"
7248038,"安い！うまい！血合カレー","スーパーの魚コーナーの片隅で思い出してください。あなたの家計を救うチャンス",30696264,"2023-07-05 21:57:52","2023-07-05 21:57:50","2023-07-06 11:38:00"
7251604,"1・2歳に◎ズッキーニのソテー","ズッキーニ自体の甘みがおいしいので味付けしなくても子どもはパクパク食べてます。大人にもおいしいです。",10475640,"2023-07-10 00:23:21","2023-07-10 00:23:18","2023-07-10 00:31:26"
4829277,"ブリーチーズのトリュフオイルがけ","おつまみに。トリュフオイルとチーズって合うんですね。",10475640,"2017-12-02 01:26:08","2017-12-02 01:13:57","2020-02-19 23:40:03"
4126155,"ほうれん草のめんつゆおかか和え","ほうれん草の簡単すぎる食べ方。でもお弁当にも使えて、すごく便利です！",6795544,"2016-10-17 07:14:15","2016-10-16 22:11:17","2016-10-17 07:14:15"
6013785,"基本は放置！ラムシャンクの和風煮込み","放置するだけでトロトロのすね肉が食べられます。 ",30696264,"2020-02-01 10:07:29","2020-02-01 10:07:27","2020-02-01 11:03:31"
5413944,"我が家の豚の角煮","定番メニューの豚の角煮です。 圧力鍋で簡単にとろとろになります！",15735327,"2018-12-31 10:33:48","2018-12-16 11:30:21","2019-01-10 11:37:01"
3175084,"タマネギ入り☆ツナマヨでホットサンド","バウルーで作る簡単ホットサンドレシピ",6795544,"2015-05-14 16:00:05","2015-05-14 15:59:58","2015-05-28 15:31:53"
4109958,"鮭フレークとごまのオイルおにぎり","少ない材料で作るオイルおにぎり。お弁当にもってこいです。",6795544,"2016-10-07 10:07:43","2016-10-07 10:07:37","2016-10-07 10:14:37"
5408898,"ポトフのアレンジリゾット","ポトフの残りをアレンジしました。朝ごはんにどうぞ",15735327,"2018-12-12 11:34:38","2018-12-12 11:34:23","2018-12-12 11:42:11"
5104901,"アイスコーヒー 2~3人分","ハンドドリップで淹れるアイスコーヒーの分量メモです。たっぷり2人分、かるく3人です。",10475640,"2018-06-03 11:22:58","2018-06-03 11:22:54","2021-08-16 09:07:50"
1019411,"お好み卵サンド","お好み焼きのソースで味付けした卵サンドです。ボリュームたっぷりでモリモリ食べましょう。",1850835,"2010-01-24 21:02:43","2010-01-24 21:02:43","2011-07-14 11:37:32"
5116829,"わが家の簡単いぶりがっこポテサラ！","我が家のポテトサラダです。 電子レンジで簡単！いぶりがっこやきゅうりの食感がアクセントで美味しいです。",15735327,"2018-06-11 18:32:52","2018-06-10 20:51:32","2019-01-22 17:06:28"
4766071,"【きゅうり無し】レタスで生ハムユッケ","生ハムユッケをレタスで！",10475640,"2017-10-19 21:36:34","2017-10-19 21:34:15","2017-10-20 00:17:32"
2251689,"旬のグリーンピースで！うぐいす餡","夫実家から送られてきたフレッシュなグリーンピースを活用。白玉に添えたり和菓子にアレンジしたりと、活用できます。",1850835,"2013-09-02 11:53:12","2013-06-10 10:35:13","2014-07-15 13:31:26"
4983205,"鶏むね肉ハム 〜トリュフ風味〜","トリュフ風味シリーズ。鶏ハムにも合いました。",10475640,"2018-03-14 23:17:43","2018-03-14 23:17:39","2018-03-14 23:35:42"
5416590,"すた丼！目指せまぜそば直太朗","お昼ご飯にどうぞ。 すた丼で元気が出ます！",15735327,"2018-12-18 09:03:31","2018-12-18 09:03:02","2018-12-20 13:54:45"
5030939,"苺とクリームチーズの生ハム巻き","女子会、パーティにぴったり♪簡単に作れる生ハムの前菜です。",6795544,"2018-04-15 18:52:05","2018-04-15 18:52:01","2018-04-15 19:00:54"
4102681,"簡単キャラ弁！卵焼きでハロウィンのり巻き","ハロウィンのキャラ弁にぴったり！ジャックオランタンの簡単かわいい卵焼き入りのり巻きです。",6795544,"2016-10-03 12:45:41","2016-10-03 12:45:37","2016-10-18 09:38:39"
4982069,"ハムとチーズとトリュフ塩のトースト","普通のトーストにトリュフ塩をかけるだけで贅沢気分を味わえます",10475640,"2018-03-14 10:11:00","2018-03-14 10:10:55","2018-03-14 10:11:04"
5346202,"ベーコンとチーズの卵かけご飯","卵かけご飯にチーズとベーコンを加えて、洋風にアレンジしました！",15735327,"2018-11-21 08:43:12","2018-11-21 08:43:08","2021-01-01 14:07:36"
6008338,"煮込むだけ！土鍋ラム肉チャンスンマハ","ひたすら煮込むだけなのに滋味あふれる美味しさ",30696264,"2020-01-28 16:01:19","2020-01-28 15:58:51","2020-02-01 11:57:29"
6255826,"糖質オフ！アーモンドミルクでいちごミルク","簡単に作れて、おやつにぴったり！罪悪感なく、美味しく飲めるドリンクです♪",6795544,"2020-05-25 22:29:42","2020-05-25 22:29:39","2020-05-26 00:07:47"
2332714,"圧力鍋で簡単！スペアリブの赤ワイン煮込み","圧力鍋で15分！驚くほど簡単に柔らかな煮込みができます。トマトケチャップと赤ワインで旨みたっぷり！おもてなしにも便利。",1850835,"2014-12-16 10:41:33","2013-09-03 09:08:23","2016-03-15 12:14:55"
3439672,"基本のツナマヨ","おにぎりの定番具材ツナマヨ。改めてレシピにしてみました",6795544,"2020-05-29 19:35:18","2015-10-04 09:43:27","2020-05-29 19:35:18"
5150742,"アボカドの瀬戸内レモン塩＆レモスコ和え","瀬戸内のレモン塩とレモスコを和えました",10475640,"2018-07-03 01:23:44","2018-07-03 01:23:41","2018-07-03 11:30:48"
6177411,"春キャベ納豆と鮭の塩昆布蒸し","鮭と春キャベツで春の味覚堪能。納豆のせてボリューム感も◎",30696264,"2020-04-28 21:08:36","2020-04-28 21:06:30","2020-04-30 10:30:14"
7251614,"鶏ハム","いつも作ってる鶏ハムです。",10475640,"2023-07-10 00:36:18","2023-07-10 00:36:16","2023-07-13 15:59:03"
3268832,"ハムと人参のエジプト塩炒め","お気に入りの万能調味料『エジプト塩』を使った、彩りのいいおかずです",6795544,"2015-07-01 11:16:12","2015-06-30 21:59:00","2015-07-01 11:18:09"
5474277,"ごま油が合う◎ほうれん草の塩昆布和え","材料はシンプルにほうれん草と塩昆布だけ！茹でて和えるだけの簡単メニューです。お弁当にもおすすめです。",6795544,"2019-01-27 21:02:24","2019-01-27 21:01:59","2019-01-27 21:07:10"
6316525,"糖質オフ！パクチー搾菜豆腐","エスニックな冷奴です。パクチー好きな方はぜひ！ナッツの食感もいい感じです。",6795544,"2020-06-24 12:50:03","2020-06-24 12:50:02","2020-06-24 12:55:13"
7220321,"市販の汁なし坦々麺のタレで◎豆腐干","豆腐干を使ったアレンジメニュー。冷やしても美味しいです。お弁当にも持っていけます。",6795544,"2023-06-05 13:32:42","2023-06-05 13:32:39","2023-07-05 17:41:14"
7261188,"塩麹マグロのカルパッチョ","スーパーの安いマグロが驚くほど美味しくなります",30696264,"2023-07-20 21:34:53","2023-07-20 21:34:51","2023-07-20 21:44:17"
7262515,"鶏ハムにおかずラー油でなんちゃって口水鶏","全く口水鶏ではないけど、おいしいよ",10475640,"2023-07-22 13:11:44","2023-07-22 13:11:41","2023-07-26 14:09:30"
2238013,"シュトロイゼルクーヘン","母が小さい頃に作ってくれた大好きな菓子パンです。今はうちの子ども達にも大人気です。",1850835,"2013-05-28 09:48:54","2013-05-28 09:48:54","2016-05-24 11:31:48"
6495829,"めんツナかんかんとキャベツの和風サラダ","福岡の明太子味のツナ缶と、千切りキャベツを使ったヘルシーサラダです。",6795544,"2020-10-19 13:00:12","2020-10-19 12:54:10","2020-10-19 13:02:45"
5399629,"風邪の時に！きのこと卵の雑炊","風邪の時の朝ごはんに。優しい味です。",15735327,"2018-12-05 14:26:46","2018-12-05 14:26:27","2018-12-05 19:07:34"
5770187,"そうめんカッペリーニ","トマトとバジルの冷製カッペリーニをそうめんで",10475640,"2019-08-03 21:14:57","2019-08-03 21:14:54","2019-08-03 21:29:25"
3051757,"お弁当に☆ベーコンと椎茸の洋風混ぜごはん","お弁当にぴったりの簡単洋風混ぜごはん。ハンバーグなどにも合いそうです☆",6795544,"2015-03-06 12:13:33","2015-03-06 12:05:48","2015-04-28 07:43:28"
4231653,"リボンにんじんの和風炒め","お弁当の彩りに。人参の切り方を変えるだけで、詰めた時の印象も変わります。",6795544,"2016-12-12 08:24:37","2016-12-11 22:22:26","2016-12-12 09:49:53"
5013978,"四川風？具沢山トマトラーメン","花椒でピリリと辛いトマトラーメンです！",10475640,"2018-04-04 17:37:39","2018-04-04 17:37:35","2018-04-04 18:32:18"
5476611,"納豆とキムチの爆弾混ぜうどん！","スタミナ栄養のあるうどんです。 うどんの代わりにごはんにして納豆卵かけご飯にしても美味しいです！",15735327,"2019-01-29 11:25:49","2019-01-29 11:25:47","2019-08-07 14:04:09"
1468815,"母直伝♪うちの茹でない塩豚","母がよく作ってくれた塩豚は、熱湯の中で保温することで火を通します。パサつかず、誰でも失敗なくしっとり仕上がります。",1850835,"2011-06-13 06:27:57","2011-06-13 06:27:57","2016-03-15 12:12:16"
5010327,"鶏皮チャーハン","鶏皮が余ったらチャーハンを作っちゃいましょう",10475640,"2018-04-02 01:23:00","2018-04-02 01:22:55","2021-09-11 00:37:49"
7241946,"オフィスでできる！グラスパフェ","特別な材料や道具なし！あなたの思いをパフェにぶつけてください。",30696264,"2023-06-28 22:35:56","2023-06-28 22:35:53","2023-06-28 22:59:22"
