"id","title","description","user_id","photo_saved_at","created_at","updated_at"
5947306,"ピリ辛！キムチ鍋の素で煮込みうどん","ピリ辛の煮込みうどんです。 ランチにいいかなと思います！ ",15735327,"2019-12-12 14:12:02","2019-12-12 14:12:01","2019-12-12 14:23:13"
2259251,"豚バラとパプリカの胡麻ドレ炒め","味付けは胡麻ドレのみ！忙しい朝のお助けお弁当レシピです。",1850835,"2013-06-17 12:26:19","2013-06-17 12:23:51","2013-06-19 13:53:47"
2975864,"フライパンで！山芋入りふわふわ和風卵焼き","だしの味がきいた、ふわふわ和風の卵焼きです。キャベツで食感をプラス",6795544,"2015-01-22 15:04:20","2015-01-22 13:37:47","2015-01-22 16:43:05"
3422505,"鶏の塩麹焼き","お弁当に便利。普通の照り焼きに飽きたらコッチもお試し下さい。",1850835,"2015-09-24 16:35:12","2015-09-24 16:24:06","2015-09-24 16:35:12"
4141915,"サバ味噌缶とナスのレンジ蒸し","サバ味噌缶詰があったので、アレンジしました。電子レンジを使うので、コンロで別のおかずの調理ができます。",6795544,"2016-10-25 10:09:10","2016-10-25 10:09:07","2016-10-28 11:59:01"
5548972,"ハムとキャベツのアンチョビソース炒め","アンチョビソースが隠し味の洋風野菜炒めです。しっかり味で冷めても美味しいので、お弁当にも◎",6795544,"2019-03-15 01:18:39","2019-03-11 12:42:34","2019-03-15 01:19:30"
7247285,"サーモンを食べる和風サラダ","切って和えるだけ！ 白ワインなどお酒にも合う味です。",15735327,"2023-07-04 23:58:41","2023-07-04 23:58:38","2023-07-05 09:54:06"
7250982,"絶品！なすとアンチョビのオイルパスタ","トロッとしたなすとアンチョビをたっぷりのオイルで和えた「メランツァーネ」と呼ばれるパスタ。なすの美味しい時期にどうぞ。",1850835,"2023-07-09 11:08:32","2023-07-09 11:03:31","2023-07-09 11:31:31"
5122232,"炒めるだけ☆簡単♪和風パスタ！","簡単でおいしい和風パスタです。オクラも入ってるよ。",15799167,"2018-06-14 12:49:18","2018-06-14 12:29:04","2018-06-14 12:49:18"
4215290,"ちょっぴり洋風！卵1個でコンビーフ卵焼き","コンビーフをアレンジして、洋風の卵焼きを作りました。",6795544,"2016-12-02 23:29:23","2016-12-02 23:28:23","2016-12-02 23:35:46"
5103926,"ちりめん山椒の冷製パスタ","トマトとレタス、ちりめん山椒のさっぱりパスタです",10475640,"2018-06-02 17:43:52","2018-06-02 17:43:48","2018-06-02 20:39:31"
2800305,"お弁当に！卵1個で作る甘い卵焼き〜♡","甘いタイプの卵焼き。1人分の卵焼きなら卵１つで十分！ミニサイズでお弁当の隙間埋めにもおすすめです◎",6795544,"2014-09-16 21:22:52","2014-09-16 21:20:56","2018-10-27 21:57:30"
3351150,"お弁当に☆マンゴーヨーグルトアイス","夏はスープジャーで美味しいデザートを。汁漏れの心配もないので、フルーツを安心して持って行けます。",6795544,"2015-08-17 18:31:40","2015-08-17 18:15:47","2015-08-19 18:14:12"
3627949,"4STEPでシュッと簡単豚キムチ","シュッと作れてガッツリ満足豚キムチです！",10475640,"2016-01-17 15:44:59","2016-01-17 15:42:24","2016-01-25 10:54:30"
5024351,"クリームチーズとみかんジャムのトースト","クリームチーズとジャムトーストシリーズ",10475640,"2018-04-11 13:26:39","2018-04-11 13:26:35","2018-04-11 13:26:39"
2577898,"クスクスのナッツサラダ","クスクスを使ったちょっぴりスパイシーでオシャレなサラダ。簡単で食卓が華やぎます。",1850835,"2014-04-08 13:16:43","2014-04-08 12:47:16","2014-05-20 09:40:57"
3606249,"大豆ミートの簡単ピカタ","大豆ミートを使った簡単ピカタ。お弁当にもオススメです。",6795544,"2016-01-06 08:07:19","2016-01-06 08:02:37","2016-01-06 20:14:52"
4123363,"お弁当にも◎ツナと人参のピリ辛炒め","とっても簡単で彩りもいいので、お弁当おかずによく使います。常備菜としてもいいです。",6795544,"2016-10-15 10:21:54","2016-10-15 10:21:48","2019-06-24 07:18:23"
5590172,"肉みそ","ごはんに乗せても、焼きそばやパスタにしても◎の肉みそです。",10475640,"2019-04-06 21:11:39","2019-04-06 21:11:35","2019-04-06 21:29:22"
7119687,"糖質制限中に◎搾菜入り中華風炒り豆腐","糖質制限中なので、主食代わりに作った中華風炒り豆腐。ザーサイのおかげで食感もいい感じです◎ チャーハンの代用としても。",6795544,"2023-02-19 18:29:09","2023-02-19 18:10:28","2023-02-19 18:29:09"
3830933,"市販のジャンで味付け、いつもの焼肉","愛用のジャンで作るいつもの焼肉。冷めても美味しいのでお弁当によく使ってます",6795544,"2016-04-28 10:56:26","2016-04-28 10:56:22","2016-05-01 10:07:27"
7247521,"寿司酢で簡単！野菜のマリネ","寿司酢は万能調味料。良い酢を使うとびっくりするくらい料理が変わります。切ってあえるだけ！",30696264,"2023-07-05 11:26:59","2023-07-05 11:26:57","2023-07-05 12:02:38"
3917095,"人参とポルチーニ茸のバター醤油炒め","人参のシャキシャキ食感がいい感じ。彩りがいいので、お弁当のおかずにもオススメです。",6795544,"2016-06-12 22:02:00","2016-06-12 22:01:56","2016-06-12 22:14:33"
4284532,"柚子胡椒が香る！卯の花","和の定番お惣菜。柚子胡椒をきかせてモリモリ美味しくいただけます。",1850835,"2017-01-12 13:40:01","2017-01-12 12:00:18","2017-01-12 14:18:54"
1296530,"ヴィクトリア・サンドイッチ","イギリスのティータイムに出てくる（らしい）、ラズベリージャムをサンドした伝統的なケーキ。シンプルで飽きのこない美味しさ。",1850835,"2010-11-28 14:53:53","2010-11-28 14:53:53","2013-09-22 10:18:57"
5343347,"朝ごはんに！鮭チーズ焼きTKG！","材料をのせて焼くだけです。朝ごはんにどうぞ！ 洗い物も少なく済みます",15735327,"2018-11-19 08:40:06","2018-11-19 08:32:29","2018-11-21 13:02:44"
5352834,"きのこの卵かけご飯","朝ごはんに！ きのこの旨味が卵にうつっています。 ゆず塩が効いてて美味しい！",15735327,"2018-11-26 09:46:25","2018-11-26 09:46:22","2018-11-26 15:16:59"
5852633,"ルビーチョコレートのブラッククッキー","ブラックスイーツ！色鮮やかなルビーチョコレートを使ってみたくて、いつもの定番クッキーをブラックココアで作りました。",1850835,"2019-10-03 13:01:41","2019-10-03 12:49:39","2019-10-03 13:17:06"
5944347,"無水ポトフ","ストウブの鍋で作る、野菜の水分だけで作るポトフ。",10475640,"2019-12-10 10:00:11","2019-12-10 10:00:08","2019-12-10 22:02:57"
6024589,"骨つきラム肉のルーロー煮込み","ほぼほったらかしかつ鍋一つで出来るので楽です",30696264,"2020-02-08 09:14:00","2020-02-08 09:13:58","2020-02-08 09:44:29"
6464421,"だしとまとのラタトゥイユ","だしとまとはトマトのブランド名。トマトのうまみがおいしい、味付けは塩だけのシンプルなラタトゥイユ",10475640,"2020-09-26 12:52:41","2020-09-26 12:52:39","2021-08-06 10:11:27"
3372814,"コンビーフとキャベツのエジプト塩炒め","お弁当のおかずに使える、コンビーフの簡単レシピです。",6795544,"2015-08-30 16:53:15","2015-08-30 16:42:23","2015-08-30 17:01:51"
3535234,"生ハムと貝割れのパスタ","美味しい生ハムさえあれば、誰でも簡単に極上パスタができます。",1850835,"2015-11-24 15:02:08","2015-11-24 15:02:01","2015-11-24 15:37:18"
5129877,"スープジャーで！バナナプリンの冷スイーツ","バナナとプリンを組み合わせて、冷たいスイーツに。食後のデザートにぴったりの一品。スープジャーは夏も大活躍です！",6795544,"2018-06-19 12:55:55","2018-06-19 12:55:49","2018-07-03 12:37:32"
5269698,"ネギとレタスのチャーハン","ネギとレタスのシンプルなチャーハンです。",10475640,"2018-09-28 14:56:06","2018-09-28 14:56:02","2018-09-28 14:56:09"
6008350,"羊肉の黒チャーハン","羊の脂が黒酢でさっぱり中和されていくらでも食べれます",30696264,"2020-01-28 16:09:03","2020-01-28 16:08:55","2020-02-02 10:03:02"
4373295,"こんにゃくのめんたい粉炒め","明太子の粉末、めんたい粉を使った簡単レシピです。",6795544,"2017-02-23 08:26:35","2017-02-22 21:49:38","2017-02-23 08:32:46"
4161134,"明太子マヨネーズで！パッカンおにぎり","噂のパッカンおにぎり！ 切れ目を入れて乗せるだけなので、柔らかめの具材だと、おにぎりで握るよりも早くて簡単です。",6795544,"2016-11-04 12:39:29","2016-11-04 12:39:25","2016-11-04 12:53:23"
5946525,"人参と玉ねぎのサワークリームサラダ","人参をさっと炒めてサワークリームで和えたサラダ。コクがありつつ爽やかに全体がまとまり、新鮮な美味しさです。ハマります！",1850835,"2019-12-11 20:54:17","2019-12-11 20:50:06","2019-12-12 10:52:35"
4542625,"材料3つ！糖質制限・ツナのマヨナッツ和え","低糖質な材料だけで作るので糖質制限中のお弁当おかずにぴったり♪ 少ない材料で混ぜるだけなので、とっても簡単です。",6795544,"2017-05-25 09:09:24","2017-05-25 09:09:21","2017-07-20 11:20:14"
5678206,"カブとミニトマトのコンビーフ炒め","カブを買いすぎたので炒め物にしました。お弁当のおかずにもオススメです♪",6795544,"2019-06-02 18:26:39","2019-06-02 18:26:37","2019-06-12 19:14:51"
7104413,"糖質制限中に！生おからのケークサレ","おからを使ったヘルシーなケークサレ。冷凍保存も可能。お弁当に持って行くこともできます。",6795544,"2023-03-05 08:36:54","2023-02-07 13:27:58","2023-03-05 08:36:54"
7247287,"薬味もりもり！しっとり鶏胸肉","さっぱり薬味が美味しい、茹で鶏胸肉です。 ヘルシーで夏にピッタリ！ 写真は鶏胸肉1/2枚です。",15735327,"2023-07-05 00:10:34","2023-07-05 00:10:31","2023-07-05 09:54:27"
2885294,"お豆たっぷり！圧力鍋でほっこりお粥","お豆としらすで栄養たっぷりの、お腹に優しいお粥です。圧力鍋であっという間に完成！お腹の調子が悪くてもモリモリいけます。",1850835,"2014-11-15 12:14:28","2014-11-15 12:14:23","2014-12-08 23:09:14"
5115223,"さっぱり簡単！厚揚げおろしポン酢","もう1品欲しい時や簡単おつまみにどうぞ！ さっぱりヘルシーで美味しいです！",15735327,"2018-06-09 21:51:40","2018-06-09 21:51:36","2018-07-07 19:27:13"
2880237,"お弁当に♪蜂蜜梅干し&大葉の簡単彩りご飯","朝の時間がないときでも超簡単！しかも緑色と赤で彩りもバッチリ！",6795544,"2014-11-12 11:13:59","2014-11-12 11:10:16","2015-04-11 18:01:28"
6762586,"グラノーラをトッピング！フルーティサラダ","グラノーラはサラダにトッピングするとカリカリで美味しい♪野菜も一緒に取れて一石二鳥です◎",6795544,"2021-05-03 10:05:53","2021-05-03 10:05:50","2021-05-03 10:17:06"
1629265,"豆乳でしっかり美味しい☆スイートポテト","材料４つ！豆乳でしっかり美味しいスイートポテトができました！バター、卵、牛乳は使わず、ヘルシーながらも満足できます。",1850835,"2011-11-16 14:34:19","2011-11-16 14:34:19","2011-11-16 14:51:18"
1948070,"メープルフレンチトースト","休日のブランチの定番。いつもうちにある材料で簡単に。メープルの香りで食卓が華やかになりますよ。",1850835,"2015-05-31 08:55:25","2012-09-09 14:31:39","2015-05-31 08:58:45"
2859798,"母の十八番！かぼちゃのグラタン","人が集まる時に母がいつも作ってくれていたグラタンです。かぼちゃの甘みにトマトソースの適度な酸味、とろ〜りチーズが最高！",1850835,"2014-10-30 12:35:23","2014-10-30 12:34:46","2016-03-15 12:16:17"
3473343,"れんこんの梅醤きんぴら","梅醤を使った簡単きんぴら。副菜として食卓にも、そしてお弁当にもぴったりです。",6795544,"2015-10-22 21:21:55","2015-10-22 20:57:09","2015-10-22 21:28:12"
5587820,"イースターにも☆カワイイうさぎのお弁当","イースターにもおすすめのお弁当♪ 折り畳みの目玉焼きを作って、盛り付ければOKの簡単可愛い顔弁です。他のおかずは何でも◎",6795544,"2019-04-05 09:40:19","2019-04-05 09:37:17","2019-04-05 10:14:38"
5671127,"蒸し鶏のピリ辛なめ茸ソース","冷蔵庫にある材料で簡単ソース作り。チキンにあいます◎",6795544,"2019-05-29 10:40:07","2019-05-29 08:26:51","2019-05-29 21:05:47"
3403249,"お弁当に☆卵1こで作る！なめたけの卵焼き","冷蔵庫にあるなめたけを入れて、いつもの卵焼きの簡単アレンジ",6795544,"2015-09-14 07:53:23","2015-09-13 22:44:34","2018-08-22 11:22:11"
5068898,"キャベツとパプリカのコールスロー風サラダ","マスタードとはちみつで、大人にも子供にもウケるお味。付け合わせにモリモリ食べられるサラダです。作りおきにも便利。",1850835,"2018-05-10 20:53:49","2018-05-10 20:53:27","2018-05-10 21:09:50"
6130570,"小松菜とサバ水煮缶のナンプラー炒め","いままで作ったサバ缶レシピの中で一番好み！ナンプラーなど、エスニックが好きな人におすすめです。",6795544,"2020-04-12 12:31:41","2020-04-12 12:17:45","2020-04-12 12:33:49"
6214797,"簡単チョコテリーヌ","初めて作ったチョコテリーヌですが、簡単にできました。 作業時間は15〜20分ほど(+焼き時間、冷やす時間)です",15735327,"2020-05-12 13:49:57","2020-05-11 00:18:11","2023-02-12 00:19:14"
7258690,"フライドポテト クリームチーズ添え","シンプルなフライドポテトです ",15735327,"2023-07-18 10:32:17","2023-07-18 10:32:15","2023-07-23 09:41:57"
1214998,"明太チーズのおつまみパイ","冷凍パイシートを使って超簡単。甘ったるくないパイなので、ビールにもよく合います。男性にいいかも。",1850835,"2010-08-21 11:01:04","2010-08-21 11:01:03","2010-08-21 11:26:50"
5236742,"アボカドキムチ","ピリッとおいしいおつまみ",10475640,"2018-09-04 21:29:42","2018-09-04 21:29:38","2018-09-04 21:29:42"
5353881,"我が家のアジフライ","さくっと、中はふわふわに仕上がります。 あじの脂の旨味が広がり、そのままでも十分美味しいです！ お好みでポン酢なども◎",15735327,"2018-11-26 21:42:22","2018-11-26 21:33:05","2019-04-23 12:25:15"
1948092,"茄子とオクラの酢味噌和え","「あと一品欲しいな…」という時に便利な簡単副菜。箸休めにほっとするやさしい味で、家族にも好評です。",1850835,"2012-09-09 14:46:59","2012-09-09 14:46:59","2013-05-24 11:18:36"
4658742,"低糖質☆千切りキャベツの豚巻きマヨポン味","サラダ用の千切りキャベツを豚肉で巻いてアレンジ！マヨラーの人はきっと好きな味♪糖質も控えめで、お弁当にも使えます。",6795544,"2017-08-08 22:45:50","2017-08-08 22:45:04","2017-08-13 18:22:07"
3890837,"混ぜ込みわかめで簡単オイルおにぎり","噂のオイルおにぎりを家にある材料で簡単に。",6795544,"2016-05-31 08:07:27","2016-05-31 08:07:23","2016-05-31 08:11:22"
5493197,"お弁当にも♪洋風コンビーフ卵焼き","コンビーフを使った洋風卵焼きです。お弁当にも◎",6795544,"2019-02-07 16:09:32","2019-02-07 16:03:40","2019-02-07 21:52:00"
6200131,"彩り鮮やか！紫キャベツのアチャール","レモン汁に漬けることで紫キャベツがより鮮やかになります。作りおきできるので、お弁当や日々の料理の彩りに。",30696264,"2020-05-13 06:53:27","2020-05-06 08:14:03","2020-05-13 06:53:27"
2255680,"キャベツと胡瓜の塩昆布和え","ご飯のお供に、あと一品欲しい時に、冷蔵庫にあるモノでできます。",1850835,"2013-06-14 08:46:07","2013-06-13 18:41:36","2013-06-14 08:49:25"
4462177,"簡単&低糖質！ささみと茗荷と葱の胡麻和え","糖質オフを目指して作ってみました。簡単で副菜としても活躍します。",6795544,"2017-04-09 16:26:24","2017-04-09 16:26:20","2017-04-10 15:22:27"
5013026,"アボカドとフルーツと鶏ハムのサラダ","フルーツとアボカドのヘルシーサラダ！",10475640,"2018-04-03 23:19:33","2018-04-03 23:19:30","2018-09-06 02:09:43"
5557058,"謎そば","中華風の、まぜそばっぽい何か",10475640,"2019-03-16 09:51:04","2019-03-16 09:50:56","2019-03-16 10:10:06"
5700564,"アジアなお味♪豚肉とスナップエンドウ炒め","大好きなシーズニングソースでいためものを。今回はスナップエンドウと豚肉の組み合わせです。",6795544,"2019-06-16 20:32:41","2019-06-16 20:32:38","2019-06-16 20:39:15"
4113502,"袋をモミモミ☆簡単フレンチトースト","朝ごはんにフレンチトースト食べたいけど時間がない！面倒！って時には、ポリ袋利用で洗い物が少なくて楽チンです♪",6795544,"2016-10-09 13:33:53","2016-10-09 13:33:48","2016-10-11 01:01:08"
5074967,"簡単！絶品！生ハムと新玉のマリネ風サラダ","ワインのおつまみに。輪切りオリーブでおしゃれおもてなし料理にも変身！ 1日置くとすこしまろやかになり、美味しいです。",15735327,"2018-05-14 23:00:41","2018-05-14 22:43:56","2018-07-11 08:49:54"
5595350,"トマトシーフードパスタ","トマト缶とシーフードミックスで簡単パスタ",10475640,"2019-04-10 02:29:37","2019-04-10 02:29:05","2019-04-10 02:38:36"
6493940,"ベビースターのパリパリ居酒屋風サラダ","麺のパリパリがキープできるように、鰹節を利用。混ぜるのは直前です！",6795544,"2020-10-18 06:51:26","2020-10-17 23:02:59","2020-10-21 11:39:34"
7243706,"限界さつま揚げチャンプルー","スーパーが閉まってお肉が買えなくてもギリギリ作れるチャンプルーです",30696264,"2023-06-30 22:13:17","2023-06-30 22:13:15","2023-06-30 22:30:19"
7258691,"ラムラグーのグラタン","ラグーソースのグラタンです。 自分用の覚書です。",15735327,"2023-07-18 10:34:05","2023-07-18 10:33:40","2023-07-19 21:03:41"
5118519,"切るだけ！簡単おしゃれなコブサラダ！","切るだけ簡単なのに、おしゃれなおもてなしサラダ！ 普段の食卓にも、大切な記念日にも、大活躍です♪",15735327,"2018-06-11 20:40:07","2018-06-11 20:39:24","2018-06-14 11:17:57"
5410298,"ポトフのアレンジうどん","カルボナーラ風の味付けのうどんです。 朝ごはんやお昼、あたたかいものをぱぱっと作りたいときにどうぞ。",15735327,"2018-12-13 12:18:25","2018-12-13 12:16:44","2018-12-13 12:18:25"
7168944,"【糖質制限】アスパラのオリーブオイル焼き","熱々ほくほくで食べるアスパラのレシピです。糖質制限中にもピッタリ。塩の種類を変えると、簡単に味変できます。",6795544,"2023-04-09 09:00:12","2023-04-09 09:00:00","2023-04-09 09:06:07"
2845264,"お弁当に！簡単・おくらの梅おかか和え","汁気もないので、お弁当の隙間埋めにも活躍！ 何度もヘビロテしてるレシピです(*^^*)",6795544,"2018-07-03 00:14:03","2014-10-19 19:09:56","2018-07-03 00:14:06"
5445593,"甘くて食べやすい♪コーンつくね","ポロポロ食べづらいコーンをつくねに混ぜて、小さな子供でも食べやすくしました。",6795544,"2019-01-17 21:08:33","2019-01-09 23:42:56","2019-01-19 11:25:07"
5519950,"お弁当に！まきまき◎ベーコンエッグ","ベーコンエッグをお弁当に！見た目は卵焼きですが、ベーコンが主役です。",6795544,"2019-02-21 21:27:19","2019-02-21 21:26:33","2019-02-21 21:35:49"
1630052,"とろける食感☆母のチーズケーキ","ふわっとした口どけがたまらない、大好きなチーズケーキ。母の優しさが詰まったような、スフレタイプの秘伝のレシピです。",1850835,"2011-11-17 11:41:32","2011-11-17 11:41:31","2016-04-27 16:26:48"
3149277,"かぼちゃのポタージュ","あっためても、冷やして冷製にしてもおいしく食べられます☆",10475640,"2015-04-30 00:29:36","2015-04-29 20:32:04","2016-05-06 11:46:47"
3830820,"顔弁の作り方〜焼きそば編〜","キャラ弁よりも簡単なので、不器用な方、初心者の方にもオススメです。アレンジも色々楽しめます。",6795544,"2016-04-28 09:30:25","2016-04-28 09:29:18","2016-10-18 09:37:47"
1201181,"ねぎと桜エビの焦がし醤油パスタ","ねぎ×桜エビに焦がし醤油をプラスして、香ばしさアップ。家にあるものだけで簡単にサッと作れるので、おススメです。",1850835,"2010-08-03 10:21:39","2010-08-02 10:25:25","2010-08-03 11:50:39"
4174309,"鶏モモ肉で！シンプル照り焼きチキン","お弁当にもぴったりの照り焼きチキン。今回は砂糖ではなく蜂蜜で作ってみました。",6795544,"2019-06-01 23:17:22","2016-11-11 00:16:44","2019-07-08 23:20:46"
4482330,"糖質制限ブランパンで！スパムエッグサンド","低糖質なブランパンを使ったサンドイッチ。たっぷり卵をのせて、見た目も食べても満足！糖質を気にしなければロールパンで代用可",6795544,"2017-04-20 16:46:24","2017-04-20 16:46:18","2017-04-20 17:25:12"
6458712,"盛り付け簡単！生ハムと桃のサラダ","桃の甘さと生ハムのしょっぱさが絶妙にマッチ！簡単おしゃれサラダです。きれいに盛り付けるの大変なので、大ざっぱで♪",6795544,"2020-09-22 15:24:51","2020-09-22 15:13:04","2020-09-22 17:13:59"
4256296,"ベーコンとキャベツの洋風マスタード炒め","キャベツとベーコンの炒め物に、マスタードを加えて、いつもの炒め物をアレンジしました。",6795544,"2019-06-24 07:20:19","2016-12-26 08:30:57","2019-06-24 07:25:39"
5355651,"煮林檎と胡桃のパウンドケーキ","秋冬のこの時期に食べたいパウンドケーキをイメージしたらこうなりました。煮林檎の甘酸っぱさと胡桃のざっくり感が好き。",1850835,"2018-11-28 09:25:15","2018-11-28 08:51:11","2018-11-28 09:25:17"
5441920,"ひと手間でおいしいカレーライス","甘くて辛いおいしいカレーです。ブレンダーを使うことで野菜の甘みとうまみがぐっと増します。",10475640,"2019-01-07 17:10:22","2019-01-07 17:08:00","2019-08-27 18:39:34"
7238441,"オクラとピーマンと茗荷で夏の味噌汁！","夏の旬の野菜を使った夏らしいお味噌汁です。ミョウガでさっぱり！",15735327,"2023-06-24 22:33:01","2023-06-24 22:32:57","2023-06-24 22:48:33"
1210353,"イカのレモンマスタードマリネ","柔らかいイカをモリモリ味わえます。マスタードを使ってメリハリのあるマリネに仕上げました。",1850835,"2010-08-14 16:43:49","2010-08-14 16:43:48","2011-07-14 11:45:02"
3932878,"生ハムとごま昆布のおにぎり","ちょっと意外？な、生ハムおにぎりとごま昆布の組み合わせです。あまじょっぱさがいい感じ。",6795544,"2016-06-21 09:43:27","2016-06-21 09:43:24","2016-06-21 11:15:16"
4109213,"【鶏を焼いて余った油で】ハイカロリー米","鶏を焼いて余った鶏油がおいしいご飯に！",10475640,"2016-10-06 21:00:43","2016-10-06 21:00:38","2017-07-22 14:20:02"
5954036,"人参と大根のめんつゆ炒め","きんぴら的な甘辛い感じでおいしいです。ちょっとした小鉢に。",10475640,"2019-12-18 00:42:30","2019-12-18 00:42:28","2019-12-18 00:50:36"
2472071,"豚バラの赤味噌炒め","しっかりあじで冷めても美味しいお弁当おかず。安いバラ肉で簡単にできます！",1850835,"2014-01-22 15:50:12","2014-01-22 15:50:07","2014-01-22 15:54:59"
3921533,"マッシュポテトのハムカップ焼き","大量に作ったマッシュポテトを小分けにして冷凍しておくと、簡単におかずが作れます。",6795544,"2016-06-15 08:11:32","2016-06-15 08:07:53","2016-06-28 20:41:35"
5258231,"アイスコーヒーひとりぶん","アイスコーヒーひとりぶんの分量の覚書です",10475640,"2018-10-14 13:07:01","2018-09-20 10:57:17","2018-10-14 13:07:01"
6093709,"お弁当にも！豚もつと根菜の中華ピリ辛煮","最初に豚もつを茹でこぼし余計な脂をとることで、冷めても固まらず美味しくいただけます。",30696264,"2020-03-22 10:26:24","2020-03-22 10:11:56","2020-03-22 11:09:02"
4153294,"生チョコスライスで！チョコくるみトースト","ブルボンの生チョコスライスを買ったのでくるみを乗っけて簡単アレンジ！",6795544,"2016-10-31 10:52:26","2016-10-31 10:52:21","2016-12-05 14:23:50"
